0,1,2,3,4,5,6,7,8,9,10,11,12,13,14,15,16,17,18,19,20,21,22,23,24,25,26,27,28,29,30,31,32,33,34,35,36,37,38,39,40,41,42,43,44,45,46,47,48,49,50,51,52,53,54,55,56,57,58,59,60,61,62,63,64,65,66,67,68,69,70,71,72,73,74,75,76,77,78,79,80,81,82,83,84,85,86,87,88,89,90,91,92,93,94,95,96,97,98,99,100
2020.02.01,"""삼성폰·현대차 사겠다""…韓 기업 中 신종 코로나 기부에 현지 반응 '찬사'","""우한 교민, 아산·진천 주민 응원해요"" 기업들 물품지원 잇따라","목포해경, 엔진 수리 중 해양오염 일으킨 선박 추적검거",한국 수출 부진 터널 거의 지났다…신종코로나 '돌발 변수',제주 마라도 해녀 시위로 여객선 4척 한때 접안 못 해,1월 수출 14개월 연속 내리막…일평균 수출은 반등(종합),"[종합]한국 수출 1년2개월째 감소…""신종코로나 영향 아직 없어""",[2보] 1월 수출 6.1%↓…일평균 수출 14개월만에 첫 상승,[속보]1월 수출 전년비 6.1%…14개월 연속 하락,[증시풍향계] 춘제 연휴 후 첫 개장 중국 증시 주목,[표] 주요 경제지표 및 행사 일정(2월 3일∼7일),다음주 1월 소비자물가 주목…물가상승폭 확대되나,1월 수출 6.1%↓…일평균 수출 14개월만에 첫 상승,"신종코로나, 주요국 금리정책에도 중요 변수로 대두","화제 속 자동차, 이름에 숨은 의미는?","""승무원 엄마는 죄인인가""…신종코로나 '공포'에 우는 승무원들",전국 휘발유 가격 10주 연속 상승 멈추고 이번주 하락,,,,,,,,,,,,,,,,,,,,,,,,,,,,,,,,,,,,,,,,,,,,,,,,,,,,,,,,,,,,,,,,,,,,,,,,,,,,,,,,,,,
2020.02.02,"'中관광 금지' '중국인에 단기비자 발급 중단' 한다더니…""검토""로 말바꾼 정부",2월 수출은 '반도체 덕' 보나,작년 생수 수입 1000억원 돌파,핵폐기물 재검토委에 쓴소리 낸 정재훈 한국수력원자력 사장,"공공기관, 작년 목표보다 8000명 더 뽑았다","항만 물동량 증가율, 금융위기 이후 최저",마스크 대란…'숨쉴 틈 없이' 도는 도레이·휴비스 부직포 공장,"SK에너지, 탈황설비 내달 본격 생산","제네시스 첫 전기차, SK배터리로 달린다",전기차 이달에 사면 한달 월급 버는 셈,"금융권, 우한 폐렴 피해 중기·소상공인 지원","""소비 큰손 '오팔세대' 잡아라""…간편결제 앱 고객 쟁탈전","안성호 에이스침대 사장 ""깐깐한 소비자 덕에 에이스침대 성장""","""내 나이가 어때서""…액티브 시니어 돕는 생활용품","중기부, 中企·소상공인에 마스크 30만개 지원",월성원전 2호기 발전 재개…터빈제어 고장 부품 교체,"정부, 경기 하방위험 촉각…'추경 카드' 나올까","""타다 운전자는 근로자 아닌 프리랜서""","한은, 신종코로나 관련 긴급회의…시장 불안 대응방안 논의","우한 쇼크 전방위 확산…""생산·수출도 앞이 캄캄""","아이스크림에듀 ""스마트러닝, 2.5조원 학습지 시장 대세될 것""",확진자 다녀간 신라·롯데免 휴업…이마트 부천점도 영업 중단,脫원전 3년…LNG 발전비용 3조원 더 늘었다,"현대차 베이징·SK 창저우 공장, 가동 또 연기…부품난에 中企도 '비명'",'공간 설계의 미다스' 다원디자인 25년 흑자경영 비결,실적 맥못추는 포스코·현대제철…철강가격 4년 만에 올리나,"[단독] 신한은행, 순이익 목표 10% 낮췄다…창사 후 처음","게오르기에바 IMF 총재 ""中 세계경제 비중, 사스땐 4% 지금은 18%…우한폐렴이 성장 위협""","LG전자, 필리핀 화산 피해 봉사활동","""한식 세계화는 디자인에서부터 출발해야""","""정월대보름 부럼 깨세요""","코오롱FnC, 유니섹스 캐주얼 '하이드아웃' 인수",우한 폐렴에 마트도 안간다…온라인몰 먹거리 쇼핑 '폭주',개인형 퇴직연금으로 절세전략 먼저 세워야,"""올해도 달러화 약세 지속…신흥국 채권 유망""",독자 브랜드·기존 가게 인수·가맹점창업…세 가지 '경우의 수'를 따져라,"""실손보험 있으면 공짜에요""…병원의 유혹이 '보험사기' 될 수도",1주택도 9억 넘으면 2년 거주·10년 보유해야 양도차익 80%공제,내 신용점수는 얼마?…앱에서 쉽고 편하게 관리 가능,믿을 만한 설계사인지 궁금하면 'e-클린보험 시스템' 클릭,"현대카드, M포인트몰서 빅데이터 기반 상품 추천","루즈앤라운지 '클래식백', 완벽한 오피스룩을 완성하다",꽃·나무·숲·바다·일몰…자연에 물든 '발리의 봄',"""이왕 쓸거면 검은색""…마스크도 패션 아이템",현대차 전기차도 중고차 가격보장…코나·아이오닉,"조달청, 일부 광고·인쇄물…조합추천 수의계약 구매대행","LG 가전 영업익, 3년 연속 월풀 제쳐",신종코로나 걱정에 온라인 생필품 거래 급증(종합),[그래픽] 신종코로나 여파 온라인 판매 증가율,"금감원 ""손태승 회장 거취, 이사회가 책임있는 판단 기대""(종합)",'BTS' 모방 상표 사용업체 상표권 등록 취소 결정,"더 편리해진 금융상품 비교공시…""내 조건에 맞게, 한눈에""","금감원, 금융소비자리포터 250명 모집",중소·중견기업 신규 설비투자에 4.5조 정책자금 대출,"한은 ""신종코로나, 중국 서비스업 타격…장기화 땐 제조업도""",서울 마곡지구에서 '저온수 이용' 차세대 지역난방 테스트,국산 서양란 점유율 20% 육박…11년 전보다 10배 이상↑,수산업경영인 융자지원 한도 3억→5억원으로 상향,"농식품부, 맞춤형 혁신식품 기술개발사업 신규과제 공모","장승화 무역위원장, 美ITC 방문…'무역구제 서울 포럼' 초청",미중 무역분쟁 여파에 작년 항만 물동량 0.8% 증가 그쳐,연안여객선 준공영제 확대한다…2개 항로 추가 선정,SK에너지 저유황유 시설 조기 준공…3월 말 생산 돌입,우한 폐렴 확산…'한국판 CES' 개최 취소하나,"[단독] 정재훈 한수원 사장 ""핵폐기물 재검토위는 본연 업무만 집중하길""","[조재길의 경제산책] 오로지 증세만…""세금 공화국이냐""",'신종코로나 무서워'…온라인 생필품 거래 2배 '껑충',"LG전자, 필리핀 화산 폭발 이재민 위해 봉사활동","르노·닛산·미쓰비시車 연합, '곤 파동' 속 세계 3위로 밀려","우버, 신종코로나 우려에 멕시코서 240명 계정 정지","재일한국청년회, 15일 도쿄서 '제1회 취업·전직 박람회'",'신종 코로나' 확산 우려에 기업 해외 시장 개척도 난항,마이크 무어 전 WTO 사무총장 별세,"'적과의 동침' 조현아·'사면초가' 조원태, 주총까지 행보는",목포시 '1천만 관광시대' 달성 총력…열악한 숙박시설 걸림돌,[통통 지역경제] 6차산업 선도·미래 농업 모델 '화천 농부들',美 언론이 뽑은 '최고 가성비 차'는…쏘렌토·카니발·쏘울·K3,"LG 가전, 세계 1위 도약 '속도'…월풀 영업익 3년째 제쳤다",'신의직장' 공공기관 채용목표 초과 달성…2년 연속 3만3천명,손태승 우리금융 회장 7일 이사회서 거취 밝히나,"금감원 ""손태승 회장 거취, 이사회가 책임있는 판단 기대""","신한금융, 그룹차원 신종코로나 피해 지원 추진",신종코로나에 놀란 세계 증시 시총 열흘새 3000조원 증발,"행사·회의 취소, 영업점 방역…은행 신종코로나 경계 강화",신종코로나에 커지는 금리인하 기대…경제 타격 정도가 관건,"""중국내수 1% 줄어도 한국 GDP에 주는 영향 미미""","라임, 환매 연기에 적자 내고도 1인당 2억원대 급여",'펀드런'에 속수무책…비유동성 자산이 사모펀드 뇌관,사모전문 운용사 37% 순자산 줄어…연간 1.3조원↓,"금감원, 사모펀드 전수조사 완료…'제2 라임' 나오나 촉각","감염병 돌면 백화점 대신 '인쇼'…""메르스때 백화점 소비 18%↓""","정부, 신종코로나 경기하방위험 촉각…""타격 커지면 추경"" 전망","롯데백화점 '291포토그랩스', 시간 주제 사진전",작년 생수 수입액 1000억원 첫 돌파…'백산수' 약진 영향,신종코로나 걱정에 집밥·홈술 늘어난다,"""크고 비싼 게 잘 팔린다""…삼성, 국내 프리미엄TV 시장 견인",,,,
2020.02.03,車업계 신종코로나 '직격탄'…현대차 이르면 내일부터 생산중단(종합2보),"링컨 MKZ 단종, 역사 속으로 사라진다","신한금투 ""독일 헤리티지 DLS, 자산매각 통해 원리금 상환 추진""",신종코로나 여파로 현대차 일부 공장 이르면 4일 오후 휴업,예탁원 노사 갈등 일단락…이명호 신임 사장 내일 첫 출근,'청약홈' 오늘 오픈…첫날부터 서버 다운 등 한때 접속 오류(종합2보),"과천봉담고속화도로서 BMW 차량 화재…""엔진쪽서 연기""","""중앙회, 개별 중소기업 대신해 대기업과 납품단가 조정 협상""",우한 폐렴 피해 소상공인에 200억 긴급 지원,100도 달성한 사랑의 온도탑,"KT, 비대면 서비스 강화","정도현 前 LG전자 사장, 희성그룹 부회장 맡아",車 중견3사 '1월 쇼크'…판매 반토막 났다,지분 1%가 아쉬운 조원태…한진칼 주총 전자투표 도입 적극 나서,"홍남기 ""취약계층에 마스크 공급 고려해보겠다""",우한폐렴 '비상'…수출 총력 지원,"""대기업 61% 여전히 연공서열…30년 근로자 임금, 신입사원의 4배""",외투기업 사내유보금 재투자도 인센티브…FDI 활기 찾나,"한국-말레이, 5조 규모 통화스와프…3년 연장",금융·운송업 등 3개월간 계열사 9곳 늘린 카카오,신종코로나에 분양 또 늦춰지나…견본주택 개관 속속 취소·연기,'저금리' 시대…연 5% 준다는 하나銀 적금에 20만명 몰려,"홈플러스, 소아암 환자 기부캠페인","현대정밀 대표, 30억 기부 약정","울상 짓는 명동상인들…""매출 10분의 1로 줄어""",LG그룹 신입사원 합동교육 연기…신종코로나 여파,"LG전자, 6년 만에 '원톱 체제' 될 듯…권봉석에 힘 싣는다","홍남기 경제부총리 ""우한 폐렴 조기종식 안되면 경기하방 압력""",대구 스타트업 성장지원 프로그램 운영사 모집,"현대車 ""中부품 차질로 휴업 불가피""","한샘·현대리바트 ""3.5조 온라인 시장서 돌파구""",소나기 규제 뚫고…'1조원 클럽' 향해 뛰는 기업들,'월 30만원 한도' 연 5% 적금에 하루 20만명 가입(종합),"인도네시아 최대 유통사와 제휴, 아모레 설화수·라네즈 공격영업",중고 의류 1㎏에 1만원…1020 줄 세운 패션 매장,"""가장 강력한 마케팅은 입소문…스토리 있는 해외 상품으로 승부""","정부, 공공부문 정규직 3년간 19만명 늘렸다",경기지표 반등도 잠시…'우한 복병'에 최장기 침체터널 들어가나,[현장에서] 징계만 내리고 'DLF사태' 빠져나간 금융당국,車 이어 배터리·디스플레이·반도체…우한發 '도미노 가동중단' 위기,"종합상사된 마트, 온라인몰에 없는 해외 상품 판다",'장고' 들어간 손태승 우리금융 회장…이사회 '비상계획' 검토,밥솥·화로…1인용 주방가전 나왔어요,장기간 준공 지연 울산 대명루첸 임시사용 승인…입주 가능,삼성重 작년 영업적자 6천166억원…올해 84억달러 수주목표,신종코로나 확산 우려에 국고채 장기물 금리 연중 최저(종합),"아이디스, 국내-베트남 '투 트랙 생산'…보안장비 매출 1조원 찍는다","'슈퍼 중견기업' 공통점은…글로벌 시장 뚫고, 사업 다각화 나서고","""가뭄에 콩 나듯 나오는 중견기업…글로벌화 지원해야""",금융시장 불안 지속…금값 오르고 주가 '출렁',확진자 부인 근무에 '화들짝'…AK플라자 수원점 하루 휴업,국내 항공사들 홍콩·마카오 노선도 감축 나서,"기아차 K5, 신차효과 톡톡 '쏘나타 눌러'",'손태승·함영주 중징계' 확정,"홍남기 만난 명동상인 ""신종코로나 여파에 전멸 상태다""",개소세 감면 종료 회복할 2월 구매조건은?,"1월 국산차, 내수 10만대 붕괴…현대차 20%대 하락","""설·글로벌경기 탓""…완성차 5개사, 1월 판매 6.0% 감소","우리은행, 금감원 키코 분쟁조정안 수용…배상 결정(종합)","손태승·함영주 중징계 확정…윤석헌 ""DLF 제재심 결과 존중""",車업계 신종코로나 '직격탄'…현대차도 국내 생산중단 초읽기(종합),신종코로나 확산 불안에 국내증시 소비관련주 '타격'(종합),국고채 금리 일제히 하락…3년물 연 1.291%,'신종코로나'에 결국 LG 배터리·모듈 중국공장도 가동중단,'DLF 사태' 손태승·함영주 중징계 확정…금감원장 결재,진안 마이산 최고 암마이봉 687.4m로 통일 표기,현대차 1월 판매 3.6%↓·기아차 2.5%↑… GV80 누적계약 2만대,"[속보] 쌍용차, 1월 7653대 판매…한달 새 40% 감소","신종코로나 쇼크 中 증시, 다시 '헬리콥터 머니' 에 기대나","진에어, 작년 영업손실 491억원…적자전환","[현장+] 명동 누빈 홍남기 ""'마스크 폭리' 강력 대응…거리 한산해 걱정""","쌍용차, 1월 완성차 7천653대 판매…작년보다 33% 감소","우리은행, 금감원 키코 분쟁조정안 수용…배상 결정","대한항공, 中노선 추가 감편…이스타는 홍콩·마카오도 감편(종합)","[고침] 국제(한인 의류업체 포에버21, 970억원에 매각 추진)","[속보] 기아차, 1월 판매 2.5% 증가 …'K5·스포티지' 효과","이성희 농협회장 국립현충원 참배…""건강한 농촌 만들 것""","신한카드, 구독경제 전용 '딥 원스' 카드 출시","[특징주] 한진그룹주, 경영권 분쟁 재점화에 상승(종합)","[속보] 현대차, 1월 내수 21.3% 감소…해외 0.6% 증가","한인 의류업체 포에버21, 970억원에 매각 추진","르노삼성차, 1월 국내외 판매 6233대…작년보다 54.5%↓",신종코로나 여행업계 큰 타격…1월 중국 여행 상품 판매 급감,"'상생 씨앗' 심는 기업들, 협력사 경쟁력 키워야 산업 생태계 살아난다","레고그룹, 레고 아이디어 10주년 기념 '국제 우주 정거장' 공개","모나미, 한정판 플러스펜 출시","하나은행, 브랜드명 KEB 떼고 새출발","한전KPS, UAE 본부 개소…""원전 정비 컨트롤 타워""","[속보] 르노삼성, '닛산 로그' 끊기자 1월 수출 77.3% 감소",공무중 소송도 보험으로 해결,"P2P 렌딧, 개인신용 누적대출 2000억 돌파","LG화학·SK이노베이션·삼성SDI, 질주하는 전기차 배터리 3社…대형 수주 잇따라","삼성전자, 명절에 날아온 감사 손편지…""삼성式 상생으로 매출 146% 늘었어요""","효성, 매년 우수협력사 해외 연수…금융권과 '네트워크론'","[속보] 한국GM, 수출 감소에 1월 판매량 '반토막'","GS, 파트너사 자금 10일 단위 정산…2000억 상생펀드로 대출 지원","KT, 中企에 5G인프라 무상 제공…글로벌 행사 동반 참여","포스코, 中企 스마트공장 구축 비용 지원·컨설팅…""철강 생태계 바꾸자""","현대모비스, 협력사에 특허 무료이전 '윈윈 체제' 구축","동국제강, 공정거래 최우수 등급 표창…노무 아카데미도"
2020.02.04,힐스테이트푸르지오수원 무순위 청약 6만8천명 몰려…1천618대 1(종합),"신종코로나에 한중 하늘길 절반 닫혔다…""사실상 입국제한 효과""(종합2보)",車공장 줄줄이 '셧다운'…현대차 5일 조업중단시 7천억원 피해(종합2보),"K2코리아, 유럽 브랜드 '아이더' 글로벌 상표권 인수","소유권 안넘기는 '공유렌털'…웰스, 업계 최초로 서비스","금투협, 부문별 대표 체제로 책임경영 강화(종합)",중대형 매장에 특화된 LGU+ 지능형 CCTV,'신종 코로나' 대책 마련 나선 지자체,쌍용차에 무슨 일이…이사회 3연속 연기,"삼성, 1초에 풀HD 영화 82편 전송할 D램 세계 첫 출시",삼성 오디오 자회사 하만…새 CEO에 미셸 마우저,"현대·기아차, 美서 '상행선'…1월 판매 6% 늘어",강렬한 눈빛…6년 만에 확 바뀌는 쏘렌토,신종코로나 우려에 산업계 행사 줄줄이 무기한 연기(종합),당좌거래정지 (4일),"""우리금융 민영화"" 공언한 금융위…'DLF사태' 중징계로 자충수 두나","박용만 ""제노포비아에 가까운 중국 기피 합당치 않아""",공정위 '美 다나허-GE 바이오' M&amp;A 제동,"일본 양대 항공사, 도쿄~베이징 노선 운휴·감편","마스크 공장 24시간 가동…성윤모 ""생산 차질없게 지원""","팜캐드, 신약개발 플랫폼 파뮬레이터 기술 공개",암호화폐 과세 어떻게…거래세? 양도소득세?,"현대차, 수소차 판매 1위 '질주'…SK, 반도체 수직계열화 완성","삼성, 의료기기 사업 GPS 벽에 부딪혀 '난항'…태양광은 사실상 중단","이성희 농협 회장, 취임식 대신 농촌 현장경영",한진 '운명의 주총' 3월27일께 열릴 듯,"티센크루프, 한국 전통 '나전 옻칠 엘리베이터 디자인' 출시","하나금융투자 ""내달 유상증자 완료후 초대형IB로 도약""(종합)",삼성 '바이오 농사' 10년…제대로 돈 벌기 시작했다,홍명종 농협은행 준법감시인,대형마트 '마스크 구매제한',"""마스크 없어 중국 공장 멈출 판""…벼랑끝 몰린 중소기업","""봄 옷 장사로 숨통 트이나 했는데""","아이더 글로벌 상표권, K2코리아가 인수","신한은행, 키코 배상 분조위 결정 입장 못정해…""시한연장 요청""",주요 백화점들 10일 휴점 추진…'코로나 사태'에 방역작업 강화,세븐일레븐 '푸드 드림 실험' 통했다…먹거리 특화매장 매출 쑥쑥,"""중국서 부자재 못 들여와 생산 못해""…""피해 中企 정책자금 2500억 지원""",대구시 시내버스 1천500여대 집중 방역,"""우한 폐렴 감염 여부, 1시간 만에 진단""","""국내 관광객조차 반토막"" 경기 관광업계 신종코로나 대책회의",현대차 국내 全공장 멈춘다…中 부품 공급 중단 '일파만파',"[새로 나왔어요] 신일, 블루투스 가습기 출시","원자력안전위, '정기검사' 한울 2호기 재가동 승인",횡령·회식비 유용·유령직원 등록…'국가R&amp;D 예산' 줄줄 샌다,조원태 회장의 '반격'…모친·동생 지지 확보,이르면 내일부터 마스크 매점매석 '엄벌',에이스침대 사상최대 실적…작년 순이익 48% 늘어 423억,씨메스가 만든 로봇 '눈'…공장 자동화 '해결사',"하나금융지주, 작년 순이익 2.4조…지주 출범 후 최대(종합2보)","이진원 티몬 대표 ""빠른 배송은 곁가지…소비자는 초특가 원한다""",네이버·카카오도 참전…격전장된 온라인 '장보기 시장',모처럼 저물가 탈출했지만…또 '우한 복병',매년 30%씩 성장·1위 제품 6개…SK매직의 '렌털 매직',"류권주 SK매직 대표 ""서비스 품질혁신 원년…더 높은 곳 올라설 것""",올해 렌털시장 40조원…SK매직에 '기회의 땅',신종 코로나 공포 확산…얼어붙은 지역경제,"금통위, 집값·경기상황 진단 놓고 '갑론을박'","하나금융, 역대 최대 순이익…'은행 쏠림'은 고민",플랜트 전문가 최성안의 '수주 선구안'…삼성ENG 2년 만에 날았다,"각종 행사 줄취소에도 이케아 동부산점, 예정대로 13일 개장",신종코로나 우려에 산업계 행사 줄줄이 무기한 연기,어업지도선 영덕누리호 취항 후 불법조업 첫 적발,"코리아센터 ""페이스북과 전략적 파트너십 상호 협약""","""중국산 부품 재고 바닥""…현대차·쌍용차 공장 '셧다운'(종합)",현대차 휴업에 협력업체 불똥…'장기화할까' 긴장,하나금융투자 작년 영업익 3천495억원…77% 증가(종합),국고채 금리 상승…3년물 연 1.331%,"검찰, '배임 혐의' 이강래 전 한국도로공사 사장 불기소 처분","""2019년 북한, 대북제재 지속에도 물가·환율 안정""(종합)",'힐스테이트푸르지오수원' 무순위 청약 쇄도에 사이트 한때 마비,//소나기 규제 뚫고 … '1兆 클럽' 향해 뛰는 기업들,"""올해 한국 성장률 전망 2.2%→2.0%…신종코로나 등 영향""","얼어붙은 부동산 시장, 예금·해외채권·리츠펀드…대안 재테크로 뜬다","""퇴직연금 투자교육 받으면 상품 이해도 향상…수익률 상승 이어져""","""美·中 무역협상 타결 등으로 불확실성 해소…美 주식·펀드 가장 유망""","이호정 RC ""車가 있는 곳에 보험이 있다""",할인은 기본…재미까지 더한 2030 신용카드,"강금순 RC ""긍정 마인드로 고객에게 안심 전해요""","[종합]하나금융, 지난해 '최대 실적'…3년 연속 '2조' 순이익 달성","엄명순 RC ""즐기면서 하는 보험 영업…믿고 맡기는 RC된 비결이죠""",부동산 투자 문 좁아진 2020년…HI-BRID 투자 떠오른다,사회초년생·구직자에게 힘 되는 금융상품 잇따라,저금리 시대…우대금리 팍팍 주는 예·적금은,"기업은행, 사회초년생 생활안정자금 바로 대출…최대 1200만원","농협생명, 당뇨병·합병증 한번에 보장…당뇨환자도 가입 가능",주택담보대출 막히자 신용대출 관심 높아져,"농협카드, 구직자·근로자 교육훈련비 지원…5년간 최대 500만원","하나은행, 청년 직장인에 최고 年 4.1% 금리…분기당 150만원 한도","KB손해보험, 뱅크샐러드에서 건강검진 불러와 가입 땐 보험료 할인","""운전병 출신 김 대리, 車보험료 13만원 할인 받았대요""","우리은행, 장기거래 고객에 年 0.4%P 우대금리…중도해지 때도 혜택","롯데손해보험, 교통사고 때 최고 1억 지원…보험료 납입면제 항목 확대","대구은행, 매주 하루씩 7개월간 소액 적금…최소 1000원부터 가능","하나금융지주 ""하나금융투자 주식 4천997억원에 추가취득""","폭스콘·닛산, 신종코로나 공포에도 다음 주 中 생산 재개",韓 창업비용 490만원…OECD 2위,"타타대우 ""준중형 트럭 시장 진출""",한국GM 트레일블레이저 1호차 주인공은 UFC 선수 정찬성,"""신종코로나까지…애써 키운 장미 갈아엎어"" 화훼농가의 탄식"
