0,1,2,3,4,5,6,7,8,9,10,11,12,13,14,15,16,17,18,19,20,21,22,23,24,25,26,27,28,29,30,31,32,33,34,35,36,37,38,39,40,41,42,43,44,45,46,47,48,49,50,51,52,53,54,55,56,57,58,59,60,61,62,63,64,65,66,67,68,69,70,71,72,73,74,75,76,77,78,79,80,81,82,83,84,85,86,87,88,89,90,91,92,93,94,95,96,97,98,99,100
2020.05.01,"마쓰다, 승합차 대명사 '봉고' 자국내 생산 중단한다",삼성디스플레이 아산사업장 화재로 일시 가동중단,자동차산업 위기 중국 '빚 내 차 사라'…소비 촉진책 총동원,이천 물류창고 화재 사망자 4명 신원 추가 확인,농촌 일손돕기 나선 농협은행장,"""포스트 코로나 일자리 창출 돕겠다""",카드산업 '33년 보호막' 깨지고…간편결제 활성화하나,"""결제한도 높아지나""…핀테크업계 기대감",178억원 들여 경주에 탄소소재 재활용 연구시설 건립,괴산에 조사료 재배 전문단지·유통가공시설 들어선다,'경기 가늠자' 트럭도 안팔린다,"글로벌 수요 절벽…""코로나 진정 안되면 5월 수출도 어렵다""","삼성 스마트폰, 공들이던 인도서 샤오미·비보에도 밀렸다","범죄자도, 격리위반자도 받는 재난지원금","SK이노, 언택트 교육 확대…""만족도 높고 직원역량 강화""","국내 車부품사 절반 ""1분기 매출 20% 감소""","""판매 절벽 막자""…르노삼성·한국GM, 공격 마케팅","SKT ""5G로 프로야구 보세요""",싱가포르·캐나다·호주·뉴질랜드에 韓 기업인 자유왕래,방진복 325배·컴퓨터 2배…'K메디컬·K언택트' 수출 급증,LG 생활가전의 힘…美 월풀 또 제쳤다,벤츠코리아 사장에 뵨 하우버,대한항공 유상증자에 '3자연합' 촉각,한물간 이도 기회 온다…'그 옛날 할리우드'가 보여준 '집적이익',이미 기대치가 높은 만큼 한계효용은 급속히 '방전'…'속 편하게' 못 즐기는 속편,"식약처, 잔류농약 기준치 이상 검출된 시래기 회수","""충남 농산물 사세요""…전국 1천301개 유통매장서 판촉행사","해남군, 서울시와 손잡고 영농철 인력난 해결한다","""올해 세계 자동차 생산 10% 급감""","정부-지자체 협업, 국도 스마트 복합쉼터 생긴다","국토부, 서울대와 수요응답형 자율주행 서비스 구현","국토부, 코로나19로 어려운 버스 업계 추가 지원","노스페이스, 어린이날 선물로 '딱'…스테디셀러 제안","김효주는 믹스후르츠, 최혜진은 페퍼민트…껌도 피팅시대!","한·싱가포르·캐나다·호주·뉴질랜드, 필수인력 이동 합의",n번방 범죄자·탈세범도 받는 '코로나지원금'…보편복지의 그늘,"김현준 국세청장, 화훼농가 돕기 '플라워 버킷 챌린지' 동참",[주코노미TV] 유가반등이 어려운 이유,"[주코노미TV] ""실물 경제 회복은 예상보다 더딜 수도""","포르쉐, 라이프치히 등 주요 공장 생산 재개","포르쉐, 코로나19 여파로 1분기 영업익 34.0% ↓","[영상]국산·수입 신차 줄줄이 출시/정부, '수소·전기차 규제혁파 로드맵' 발표[4월 5주 하이빔 뉴스]",코로나 충격 4월 수출 24% 급감…99개월만에 무역흑자 행진 멈춰(종합2보),"춘천시, 200억 규모 중소기업 육성펀드 조성…8년간 운용","""재정 35% 1분기 집행…1차 추경 집행률 87%""","히든메이커스, 풍기인견으로 만든 '샤베트 셔츠' 공개","서울신라호텔, '호캉스' 신혼여행 패키지 출시","지프, 체로키 라인업 최대 20% 할인한다","정부 ""1분기에만 재정 35% 조기집행…1차추경 집행률 87% 달성""",올해 말까지 울진 구산항에 어구보관창고 건립,"배달의민족, 오늘부터 기존 요금제로 복귀","한국GM·르노삼성, 72개월 저금리부터 월1만원 할부도 제공","디미트리스 실라키스, 벤츠코리아 떠난다",코로나19에 혼자 여행 간다…캠핑·낚시용품 판매 증가,"""코로나에도 역량 강화 필수"" SK이노베이션, 언택트 교육 확대",벤츠코리아 뵨 하우버 대표 내정…실라키스 사장 5년만에 퇴임,"창원시, 마산해양신도시 개발 방향 시민에게 묻는다","코로나 충격 4월 수출 24% 급감…""주요국 비해 내수는 양호""(종합)",'방역선진국' 4월 수출 급감했지만…바이오·헬스 29%↑,벤츠코리아 신임 사장에 뵨 하우버,"기재차관 ""수출 급감에 기업 부담 확대 우려…밀착 모니터링""","부동산114 ""강남3구 아파트값 8년만에 월간 최대폭 하락""","르노삼성·한국GM ""코로나19에 애쓰는 의료인에 할인혜택""",경기도 '유망중소기업 인증제' 참가업체 모집…30가지 혜택,"[3보] 코로나로 4월 수출 24% 급감…""수출물량 선방·내수 양호""",부산 사회적기업 닭고기로 가정간편식 시장 도전,"자동변속기 단 고성능 벨로스터 N, 5일 만에 두달치 판매","경기도, 매주 수요일 '축산환경 개선의 날' 통합 운영",[2보] 코로나 충격 4월 수출 24%↓…99개월만에 멈춘 무역흑자 행진,[속보] 무역수지 99개월 만에 적자…4월 수출 24%↓,"BMW, 신형 4시리즈…M440i도 나온다","코로나로 4월 수출 24% 급감…""수출물량 선방·내수 양호""",[속보] 4월 수출 24.3% 급감…무역수지 99개월 만에 적자,창원시 재료연구소 원 승격 계기 '신제조산업 육성',"면세점 명품, 아울렛서 판다는데…어떤 제품 얼마나 싸게?","현대차 8세대 쏘나타, 美 안전도 평가서 '최고 등급'",무너진 내수 경기 어쩌나…부산시 제5차 비상경제대책회의,"""요샌 일할 맛 납니다""…'워라밸' 문화 확산하는 저축은행",외국인 배당에 무역적자까지…4월 경상적자 커질 듯,'황금연휴'에 여행 관련 앱 '반짝 특수'…사용자 수 급반등,1년내 기존주택 안 팔면 3년간 보금자리론 못 쓴다,"카드사,  다른 금융업권과 '합종연횡'","학교 급식용 우수 국산 김치, 모바일로 판로 개척",서울시 청년주거문제 상담센터 설치…민달팽이유니온이 운영,,,,,,,,,,,,,,,,
2020.05.02,새만금 갑문서 시신 1구 발견…지난달 실종 굴착기 운전자 추정,"화천군, 국립 농산물품질관리원 사무소 설치 건의",춘천시 의암호변 도시첨단문화산단 분양 5년 만에 마무리,미세먼지 약해진 이유…코로나 여파에 석탄 발전량 15% 줄었다,마스크 착용 일상화로 화장품 매출 30∼40% 줄어,[증시풍향계] 경제재개 기대·지표 충격 '힘겨루기' 전망,[표] 주요 경제지표 및 행사 일정(5월 4일∼8일),코로나19 물가 영향 커지나…1분기 세수 규모도 관심,"코나·니로·아이오닉, US 뉴스&amp;월드 리포트 선정 최고 친환경차","피치 ""미 에너지 기업 하이일드 채권 디폴트 위험 커""",제주 해산물 음식 먹고 공연 즐기는 '해녀의 부엌' 인기,5월은 '가정의 달'…자녀 및 부모 위한 금융상품 열전,"""집에서 할 게 왜 없어"" 집콕 가전 경쟁 '눈길'","[주코노미TV] 경기 반등, 주식시장 바닥 시점은?",,,,,,,,,,,,,,,,,,,,,,,,,,,,,,,,,,,,,,,,,,,,,,,,,,,,,,,,,,,,,,,,,,,,,,,,,,,,,,,,,,,,,,
2020.05.03,"홍남기 ""생활방역 전환은 경제회복 불씨 댕길 티핑포인트""","靑 '전국민 고용보험' 과제 언급…기재차관 ""고용제도 보수해야""(종합)","S&amp;P ""한국 올 성장률 마이너스로 떨어져도 내년엔 5% 이상 반등""",전통시장은 이미 코로나 이전으로 …,연휴에 여행 대신 '명품백' 질렀다,"""입으면 시원해져요""…여름 패션 키워드 '냉감 소재'","롯데마트, 토마토 소비촉진 행사","세븐일레븐, 가족사랑 선물세트","이마트, 무항생제 생닭만 판매","CU, 제로페이 5% 추가 할인",완구업계 '언택트 제품' 출시 봇물,수출 중소기업에 최대 1억 지원,펫 드라이룸·공기청정기…반려동물 공략 나선 소형 가전업체,"현대·기아차, 美서 투싼·팰리세이드 앞세워 '4월 공포' 넘겨",한국우수상품 '온라인 소개' KOTRA,"르노삼성 ""XM3 시승도 드라이브 스루로""",'CES 최고 혁신상' 수상…삼성전자 사운드바 출시,"배재훈 ""HMM, 초대형선 띄워 전세역전할 것""","기업가정신 지수, 37년만에 '반토막'",결식 아동에 식사 쿠폰,"신한은행, 화상통화로 투자상담부터 상품 가입까지","한화생명 '한큐가입 간편보험', 만성질환자·고령자도 쉽게 가입",금융권 근무 정상화 '채비'…재택근무 중단·콜센터 정상 운영,"'분배개선 주창' 학현학파, 경제정책 라인 전면에","수출 중소·중견기업 3곳 중 2곳…""코로나로 원자재 조달·생산 취소 애로""","국민 76% ""선별적 복지가 바람직""","해외 거주 교민 ""한국프로야구 보겠다는 미국 친구들 늘었다""","BBC도 산케이도 ""한국 다시 봤다""…'K방역' 호평 기사 5천건",'메이드 인 코리아' 대접이 달라졌다,"""코로나가 4차 산업혁명 방아쇠 당겼다…진행속도 빨라질 것""","정부, 양대 노총에 ""노사정 대화하자""며 재계에는 '입 단속'","온라인서 뜬 무신사·쿠캣, 오프라인으로 간다","현금 사라지자 '동전 왕국' 흔들…풍산, 11년 만에 적자","K제조업, 위기 속에도…공장은 멈추지 않았다","""정수기에 태극기 붙여달라""…'K프리미엄'에 빠진 바이어들",5대은행 '대기업 대출' 두달 새 14조나 늘었다,"IMM, 사모펀드 첫 공시대상기업집단에",해외여행 미리 예약하면 100만원 할인…15% 싼 선불 항공권도,이번주 '한국판 뉴딜' 밑그림 나온다,지난해 33개 회사 '억대 연봉'…대기업 평균은 7920만원,"장병규 의장 ""코로나19로 4차 산업혁명 더 빨라질 것""","가정의 달 5월, 알찬 혜택 갖춘 국산차 판매조건",많이 버는 게 아니라 잃지 않길 원한다면 ELD에 관심을,점점 크기 줄어드는 햄버거…원가절감하다 단골 놓친다,전염병이 몰고온 불확실성…중요성 커진 건강보험,포스트 코로나 시대…새로운 변화에 투자하라,타인 차량 운전시간만큼만 보험료 납입,"""나눔은 보험의 또 다른 이름""…삼성생명 사회공헌 우수 컨설턴트 3人","문계화 컨설턴트 ""사람 돕기 좋아하는 성격…보험과 시너지 효과 내죠""","윤서현 컨설턴트 ""고아원서 멘토 역할 15년, 긍정 에너지 전하고파""","김순애 컨설턴트 ""도움 필요한 이들에게 가장 먼저 달려가야죠""","대구시, 디지털트윈 활용해 안전도시 구축","배재훈 HMM 사장 ""초대형선으로 한국 해운 재건할 것""","삼성·LG, 온라인 개학에 TV·노트북 등 매출 급증",[종합] 긴급재난지원금 1차 1조3000억원 내일 풀린다,"[속보] 긴급재난지원금, 내일 280만 가구에 현금지급","중소·중견기업 10곳 중 6곳 ""코로나로 부정적 영향""","정부, 코로나 대응책 영문자료 3번째 발간…총선 관리 정책 담아","소비자원 ""사람 모양 인형 완구서 발암물질 검출""","방송 광고에 사용하는 음계·리듬감, 유행어도 상표 등록된다",키움·IBK 등 6곳 중소기업 특화 금융투자회사 지정,자산 5조이상 그룹 순이익 반토막…반도체·석유화학 부진 탓,"신사업창업사관학교, 울산·전남·충북에 추가 설치","세계 5위 車 시장 인도, 지난달 내수 판매 '0'",기업가정신 지수 반토막…1981년 183.6→ 2018년 90.1,"CJ올리브영 ""고객에게 맞는 화장품 추천""","""중국인 코로나 확산때 긴장·공포보다 심심함 더 크게 느껴""","전경련 ""기업가정신 지수 1981년의 절반으로 하락""","LG전자, 테헤란로에 높이 26m 고화질 사이니지 설치","르노삼성, 찾아가는 'XM3' 드라이브 스루 시승 이벤트","삼성전자, 'CES 최고 혁신상' 사운드바 국내 출시","대한항공, 최대 1조 유상증자 추진…한진 경영권 분쟁 변수되나","[신차털기] BMW 530e, 출퇴근족 위한 '명예 전기차'","일반인도 LPG차 살 수 있게 된지 1년, 판매량 20% 늘었다",[통통 지역경제] 강원도 위기 농가·소비자간 다리 놓으니 '미소 2배',"""올 세계경제 2차대전 후 최악 침체…독일+일본 GDP 증발""","""일단 공장은 돌리는데…"" 삼성·LG, TV가전 수요절벽에 '한숨'",車수출 금융위기후 11년만에 최대폭 감소…유럽차 수입 60% 뛰어,전세계 석탄소비 3년 만에 꺾였다…지난해 1.3% 줄어,금융시장 '패닉'은 벗어났지만…5월 이후도 '지뢰밭길',"IMF ""올해 韓 구매력평가 1인당 GDP 감소""…외환위기후 첫 감소","기업 신용등급 쇼핑 방지…금감원, 감시 강화",이달 중순 두산중공업 정상화 방안 확정…밥캣 매각 여부 촉각,"금감원, 금융사 검사 시점 신중론…""종합검사는 당장 어려워""",코로나19 생활방역 전환에 금융사들 근무 정상화 준비,코로나에 멈췄던 금융권 공채 재개…채용 큰장 설 듯,'한국판 뉴딜' 경제중대본서 윤곽…비대면 의료·교육인프라투자,코로나19에 세계무역 타격…韓 2월 수출증가율은 OECD 중 3번째,롯데百 여름학기 문화센터 회원모집…'코로나 블루' 고려한 강좌,"""코로나19에 황금연휴 해외여행 대신 명품가방 샀다""","기재차관 ""美·獨 주요국 코로나로 고용충격…韓 제도 보수해야""",,,,,,,,,
2020.05.04,"위성호 前 신한은행장, 흥국생명 부회장으로","피치, 한국씨티은행 등급 전망 '부정적'으로 내려","위성호 전 신한은행장, 흥국생명 부회장 맡아",현대오일뱅크 새 캐릭터 3종,"LG전자, 러시아서 헌혈 마케팅","쌍용차, 10% 할인…한국GM, 36개월 무이자","불꺼졌던 현대기아차 美 공장, 47일 만에 전격 가동 재개",[송영찬의 핀테크 짠테크] '항공덕후' 기대 못미친 대한항공카드,"농협은행, 年 4%대 '사회초년생 대출' 내놓을 수 있었던 비결은…",축소된 은행권 '가정의 달' 마케팅,1등 1000만원…웰컴저축은행 '웰뱅톱랭킹' 이벤트,"""생활방역 전환에도…"" 산업계 '코로나 비상경영' 고삐 안 늦춰",이집트 호텔 다시 문 연다…관광산업 재개 행보,비대면 확대로 PC 수요 급증…D램값 12% 올라,"""건강한 성장 응원합니다""…금호타이어, 女 청소년들에 '핑크박스'","貿協·수출기업, 인니에 손세정제 전달","옥션, 저소득층에 장난감·의류 기부",무섭게 늘어나는 국가 총부채…올해 5000조 육박할 듯,고용기금 7兆도 '밑빠진 독'…무슨 돈으로 '전국민 고용보험' 하나,어느새 4540兆…정부·가계·기업 '빚더미',"멋 좀 아는 요즘 남자들, 핑크옷 입고 미니백 든다",마스크에 지친 피부…진정 화장품 잘 나간다,"11번가, 정관장 매장픽업 서비스","위메프, 가정의 달 '55데이' 행사","오리온, '감자속감자' 출시","제일제면소, 초여름 냉국수 2종",근원물가 21년來 최저…고개 든 'D의 공포',LCD 집어삼킨 것처럼…대형 OLED도 '中의 공습' 시작됐다,드라마 아니었어? 594만 건 클릭…SK하이닉스 '신드롬 시리즈' 인기,"명품·아울렛 매장에 긴 줄…""보복소비 터졌다""",LNG船마저 독주체제 깨졌다…조선업계도 '中의 위협',"홍남기 ""6월초에 '한국판 뉴딜' 발표한다…5월이 가장 중요""","삼성전자, 5조3600억 R&amp;D 투자 '역대 최고'","서천군, 공공기관 방문해 자연산 광어·도미 40% 할인판매","방역·언택트기술 갖춘 中企들, 포스트 코로나 시대 유망주로","렌털업계, 女心 겨냥한 '스타 마케팅'","홍남기 ""기업투자 걸림돌 되는 규제 일시적 적용 유예""","""의료진께 감사""…홍남기 부총리 '덕분에 챌린지' 동참","익산시 한아름찰벼, CJ 계열사에 고추장 원료곡으로 공급",국고채 금리 일제히 하락…3년물 연 0.975%,모호한 유성복합터미널 계약에 발목 잡힌 대전도시공사,"상지카일룸 ""에이스바이오메드 주식 100억원에 취득""","日 매체 ""일본 2분기 GDP 21% 급감…종전 후 최악 역성장""","정체된 차들 사이로 '불쑥' 무단횡단…법원 ""사고에 70% 책임""","미래에셋, 7조 규모 美호텔 인수 취소…법적공방 예고(종합)",[이달의 신차]싼타페·카운티EV·모닝·캡처,"동부건설, 두류 센트레빌 더시티 아파트 333가구 분양",위스키 투자해볼까…코로나19에 매물로 나오는 고급 위스키,[특징주] 미중 무역갈등 재점화 가능성에 희토류 관련주 급등(종합),"코로나發 디플레 우려…""정책효과"" vs ""경기부진 디플레 진행중""","장병규 前4차산업혁명위원장 ""국토부는 타다를 돌려달라""",[특징주] 김정은 등장에 방산주 급락…경협주 상승(종합),"국립수목원, 독립기념관에 '시련의 돌밭' 정원 조성",부산은행 가을야구 정기예금 4천억원 완판…3천억원 추가,창원 특산물 진동미더덕 특판행사 8∼10일 개최,"""남자는 핑크지"" 떠오르는 페미닌룩",'LNG선 독주' 중국에 깨졌지만…조선업계가 웃는 이유,"무협, 수출기업과 인도네시아에 손 세정제 5000개 기부",현대기아차 美공장 생산 재개…인도 현대차공장도 이번주 재가동(종합),한국 제조업 경기 2009년 이후 최악…4월 PMI 41.6,충남 지난해 평균 농가소득 4천401만원…전국 3위,'뚜껑 확 열리는' 지프 랭글러 오버랜드…6340만원 출시,충북도 '태양광·ESS 실증센터구축' 공모 선정…국비 100억 확보,"위성호 전 신한은행장, 흥국생명 부회장으로 선임","""금리 비교하니 한도 막혔다""…깜깜이 대출 권하는 카드사","용인시 로컬푸드, 신세계그룹 통합쇼핑몰 SSG닷컴에서 판매","신한아이타스, 디지털 신산업 추진…펀드 오류진단 시스템 개발",1000만원 더 내라더니…자신만만하던 벤츠의 '굴욕',"드래곤플라이 ""티이바이오스 주식 10억원에 취득…지분율 2.7%""","미래에셋운용, 美호텔 인수 결국 취소…매매계약 해지 통보",용돈박스부터 장난감까지…다이소 '가정의 달' 기획전,"신한은행, 경제제재 준수 가이드라인 저작권 등록",[오디오래빗] 재난지원금 'ㅎㄱㅎ' 하는 #지역화폐깡…불법인데요,다시 불붙는 재건축 수주전…후분양에 미분양 떠안기까지 '유혹'(종합),"쌍용차 ""5월 3천대 한정 최대 10% 할인·무이자할부""","서산에 첨단화학산업지원센터 구축…""기업 R&amp;D 체계적 지원""",부산 송도용궁구름다리 6월 개장…4대 명물복원 마무리,"[현장+] ""딸아 미안해""…新등골브레이커 '동숲' 찾아 삼만리",선불카드? 신용카드?…'재난지원금' 어떻게 받는게 좋을까,대전·완주에서도 '드라이브 스루'로 농산물 판매,[특징주] 미중 무역갈등 재점화 가능성에 희토류 관련주 급등,"글로벌 D램 가격 10%대 급상승…""중국 가동률 회복 영향""",근원물가 상승률 외환위기 이후 최저…경기 불황 오나,"신협, 60주년 맞아 신규 조합원 1천명에 신세계상품권 만원 증정",벤처기업 확인제도 민간 주도로 개편…갱신 기간 2년→3년,현대기아차 미국 공장 생산 재개…기아차 멕시코는 셧다운 연장,"경제 재개 먼저 한 중국, 예전과는 다르게 신중해진 소비",에어프라이어 넘보는 와플메이커…돌밥돌밥 대신 #크로플,'새조개 완전양식 눈앞으로'…충남도 치패 조기생산 성공,코로나·유가에 물가상승률 0.1%로 둔화…근원물가 20년래 최저(종합2보),"국민은행, 모바일 소액 해외송금 서비스 출시","진천군, 농업인 온라인 교육 강좌 운영",강원 산나물 특판 성황리 마무리…완판 행진에 목표량 초과,"KB국민은행, KB-이지 해외송금 서비스 출시","금감원, 사이버 보이스피싱 체험관 참여 보안기업 모집","신한은행, 경제 제재 준수 지침·교육 영상 저작권 등록",다시 불붙는 재건축 수주전…너도나도 '후분양'에 대물변제까지,"양구군, 국토정중앙 DMZ 친환경 경제순환센터 건립 추진","경기도, 코로나19 피해농가 돕기 농수산물 특판행사","무학, '좋은데이 생강' 출시"
