0,1,2,3,4,5,6,7,8,9,10,11,12,13,14,15,16,17,18,19,20,21,22,23,24,25,26,27,28,29,30,31,32,33,34,35,36,37,38,39,40,41,42,43,44,45,46,47,48,49,50,51,52,53,54,55,56,57,58,59,60,61,62,63,64,65,66,67,68,69,70,71,72,73,74,75,76,77,78,79,80,81,82,83,84,85,86,87,88,89,90,91,92,93,94,95,96,97,98,99,100
2020.07.01,중국 온라인여행사 '한국 관광상품' 판매에 200만명 지켜봤다,3분의 1 불과한 '강성' 현장파…사회적 대화 줄곧 반대,증선위 '회계처리 위반' 도암엔지니어링에 임원해임 권고,핵연료 재검토위원장 김소영 교수,"카카오페이증권 ""생활밀착형 투자문화 확산시킬 것""(종합)",사용후핵연료 관리정책재검토위 새 위원장에 김소영 KAIST 교수,"도로교통공단, '모바일운전면허 확인 서비스' 도입","코로나 대출 '끼워팔기' 했나…금감원, 시중은행 점검",한진칼 BW 공모 청약 7조원 몰려…경쟁률 24.45대 1,"요진건설, 평택 고덕서 1천100억대 지식산업센터 공사 수주",年 700억 CO 경보기 시장 열린다,"""티셔츠처럼 편하다"" 日 엄마들도 반한 '코니 아기띠'",다산신도시 택배대란 재현되나…차량 진입 막히자 배송 거부,[포토] KS-SQI 인증 수여식,성장 유망 '빅3 업종' 벤처 250곳 선정·육성,"금감원, 코로나 대출때 '끼워팔기' 은행 자체점검 지시",이재용 '인재경영' 가속도,[포토] HMM 세계 최대 컨선 7호…'함부르크'호 명명식,"개소세·신차 효과…완성차 5社, 올 최대 판매",TV용 퀀텀닷 설비 반입…삼성디스플레이 내년 본격 생산,포스코가 키우는 '한국판 실리콘밸리',"현대위아, 러시아에 車 엔진 공장","우리금융 숙원사업 '절반 해결'…금감원, 내부등급법 부분 승인","주택금융공사, 신입직원 채용…7월 16일까지 접수","케이뱅크, 1년 만에 활동 재개",中企근로자도 동결하자는데…또 '최저임금 1만원' 내민 노동계,'기후변화 리더십 아카데미' 19기 수료식,제목없음,'대타협' 끝내 걷어찬 민주노총,"조종사들이 나섰다…""이상직·국토부, 이스타 정상화에 책임""(종합)","아이에스동서 ""이앤에프사파이어사모투자 합자회사 500억 취득""","수소차 85만대 보급하고, 수소기업 1000개 키운다","백화점·마트 ""로켓보다 빠른 번개배송""","'삼성맨'이 먹는 식당 메뉴, 가정간편식으로 재탄생","""후계자 대우 없이 현장서 훈련받은 준비된 총수""",[포토] '무인 편의점 시대' 본격 개막,"[포토] 대전테크노파크-한밭대, 재생에너지 연구인력양성 MOU 체결","'편의점 운영' BGF리테일, 태양광 발전사업 진출","""안 오고는  못 배길 걸"" … 대형마트·백화점이 달라졌다",양계업체 조인 신임 대표에 김혁수 前 한국야쿠르트 사장,'선풍기 비켜!'…서큘레이터 판매 돌풍,아모레-11번가 파트너십…빅데이터 활용 마케팅 강화,"""시골장터 온 듯 흥겨운 마트""…맛집·서점 돌며 하루종일 논다","[포토] 예보, 사회적 기업 지원",'성수동 클라쓰'…요즘 뜨는 패션·뷰티 총집결,"김남호 회장 취임 ""어떤 기업 환경서도 생존""…'뉴 DB그룹' 속도 낸다",내년 7월 1일 '통합 생보사 출범' 앞두고…신한-오렌지 '인력 맞교환' 단행,"뜨거운 '골드 랠리'…금값, 8년 만에 1800달러 넘어섰다","소상공인聯 ""최저임금 차등화 안돼 유감""",마이데이터 시대…핀테크에 반격 나선 은행들,[포토] 모바일 운전면허 확인 서비스,"""아베가 우리에게 기회줘…기술 축적엔 시간 더 필요""","KDI ""좀비기업 퇴출해야 산업경쟁력 향상""",광주 코로나19 확진자 제주여행 접촉 5명 격리·8곳 방역,6월 수출 10.9% 감소…석달째 두 자릿수↓,3代 걸친 투자 50년…'시대가 원하는 기술' 주도한 삼성SDI,비대면 시대…中企 '라이브 커머스'에 꽂히다,화성탐사 로버 '퍼서비어런스' 발사 30일 이후로 세 번째 연기,남태령·동작·위례 軍 부지 개발…청년·신혼주택 1300가구 공급,"케이뱅크, 하루만 맡겨도 이자 쌓이는 '플러스박스' 출시","광주 제조업 체감경기, 5분기 연속 '암울'","2020년 상반기 국산차 판매, 내수가 살렸다","금감원, 옵티머스운용에 이어 예탁원·하나은행도 현장검사","신동아건설, 648억 규모 춘천 지역주택조합 아파트 공사 따내","""현대엘리베이터 이전 감사"" 조길형 충주시장 현대그룹 방문",6월 완성차 내수로 살았다…국내 41% 껑충·해외 32% 급감,수소차 '넥쏘' 타고 온 정의선…현대차 수소 리더십 키운다(종합),국고채 금리 대체로 상승…3년물 연 0.847%,여수산단 석유화학업종 3분기 체감경기 '먹구름',"""전시도 비대면으로""…삼성, 디지털 사이니지 가상 쇼케이스","농협, 가정간편식 '오케이쿡' 제품 8종 대만 첫 수출",허세홍 GS칼텍스 대표 '덕분에 챌린지' 동참,젊은이도 기업도 몰린다…요즘 서울서 가장 '핫'한 이곳,현대차 6월 판매 29만여대로 23%↓…그랜저 8개월 연속 1위,"수출 '반토막' 한국GM, 6월 실적도 전년 比 3분의 1 '증발'","현대차 노사, 취약계층 주거환경 개선 지원 앞장","원/달러 환율 강보합 마감…""달러 약세 랠리 중단""","무협, LG상사 등과 손잡고 중소기업 中 진출 지원","""자동차는 현대차, 가전은 LG전자"" 국가브랜드 경쟁력 1위","국내서 날아다닌 기아차, 해외 부진에 6월 실적 12.1% 감소","'5천만원 미환불' 완주 모바일쇼핑몰, 소비자 피해 보전 약속","현대차, 코로나에 수출 부진…상반기 실적 4분의 1 감소",하나은행도 예금금리 인하 합류…연 1%대 더 귀해져,"한국GM, 6월 내수 9천349대…1년6개월만에 9천대선 회복","""선풍기보다 더 잘 팔려요"" 에어서큘레이터 돌풍","쌍용차, 6월 1만대 고지 회복…전년 比 실적 18.6% 개선",XM3·QM6 견인에 르노삼성차 6월 1만4천260대 판매…23.7% 감소,"'삼성맨'이 먹는 밥, 집에서 즐긴다",안 쓰는 군부대 부지에 청년·신혼부부 공공주택 1300호 생긴다,쿠팡 로켓배송 빠르다고?…백화점·대형마트 '번개배송' 맞불,청풍호 수변 고구마밭 보리·유채·맨드라미로 단장,"""아베가 우리에게 기회를 줬다""…中企가 돌아본 소부장 1년",동남권광역관광본부 근로자 휴가비 5만∼20만원씩 지원,"쌍용차 6월 판매 1만181대, 1.9% 감소…상반기 -30%",[포토]아우디 첫 순수 전기차 'e-트론 55 콰트로',오중기 한국도로공사시설관리 대표이사 취임,"구글, 코로나19 재확산에 미국 사무실 재개 연기",충남-경기 도계분쟁 해결될까…당진 영웅바위 현장검증지역 신청,"檢, 신한은행 본점 압색…'라임 CI펀드' 부실판매 의혹[종합]","감사원, 금융위·금감원 감사 돌입"
2020.07.02,"현대차, 미국 시장서 2분기 판매 24% 감소…SUV 실적은 호조",30대 등 돌리자…'생애최초 주택구입 취득세 감면' 확대하나,"[포토]미국식 스포츠 세단, 캐딜락 CT4",대통령 특별지시…30대 내집마련 기회 확대·다주택자 규제 강화(종합),대통령 특별지시…30대 내집마련 기회 확대·다주택자 규제 강화,"[1사1병영] LG하우시스, 제37보병사단에 위문품","두산그룹, '두산솔루스 매각' 스카이레이크와 재협상","삼성 준법감시위, 7개 관계사 담당자 모아 워크숍 개최","삼성 준법감시위, 7개 관계사 참석 워크숍 개최한다","[속보] 문 대통령, '동행세일' 현장 동참…'가치삽시다'","'쇼호스트' 된 홍남기 ""통 큰 할인 많다…'소비붐' 나타났으면""",최고의 경제지식을 겨룬다…'제14회 경제퀴즈배틀',"[포토]세련미 더한 럭셔리, 캐딜락 CT5","그린카, 코레일과 제휴 할인 프로모션 운영","한화건설·우아한형제들, '포레나 배달 로봇 서비스' 협약","Seezn, 사용자 상황·기분에 맞는 콘텐츠 추천","신기한 한글나라, 아이 주도 맞춤놀이로 차별화","로젠택배, 대리점과 상생·소통 노력 높은 평가","이마트 에브리데이, 모바일 앱으로 맞춤형 혜택","All100플랜, 전문가가 100% 맞춤 설계…고객 만족",5월 방한 외국인 3만명…해외여행객 3.8만명,"더샵, 11년 만에 전면 리뉴얼…브랜드 혁신","귀뚜라미보일러, 친환경 보일러 대중화 시대 열어","신한은행, 고객 가치 최우선…4년 연속 1위","KB국민카드, 맞춤형 디지털 라이프 선도","AXA손해보험, GPS로 사고현장 바로 파악","제주항공 ""열흘내에 선행조건 다 해결해라""…사실상 파기수순(종합)","""노브랜드 버거 사장님 모십니다""","유한킴벌리, 비말차단 마스크 생산","GS리테일, 전남 농산물 구매",수박값 1주새 10% 상승…장마철로 수확량 감소,광화문 출근 동선 바꾼 스페셜티 커피 강자 '펠트',"NYT ""신라면 블랙이 세계서 가장 맛있다""","손인국 회장 ""사회공헌 늘려 中企 위상 높이겠다""",이마트 '초저가' 공세…롯데는 '노마진',"[1사1병영] 효성, 광개토부대에 위문금","""국내 첫 공장 폐열로 전기 생산""…KCC·포스텍, 친환경 기술 개발","""산업계 디지털 전환 트렌드, 서비스업에 새 기회""","정동채 前 장관, 대한석유협회장 취임",K방역서도 빛난 '이재용의 동행'…진단키트업체 생산성 79% 껑충,에스원 '범죄예방대상' 대통령 표창,"LS전선, 동해시 자활사업에 1억원 지원",SK하이닉스 '초고속 D램'…영화 124편 1초 만에 전송,"에너지공단, 창립 40주년 기념행사","기간산업안정기금, 대한항공 지원…LCC는 제외 방침","""中企·소상공인 대출만기 추가 연장…10월 연체대란 막는다""","[단독] ""임금피크 직접 해결""…시니어 금융노조 출범",카드 없인 커피도 못 먹어…'현금 없는 매장' 확산,"슈피겐코리아 ""美 아마존으로 눈 돌린 게 성공 발판""","""써본 사람이 잘 안다""…소비자 입소문 올라야 '최고 브랜드'",0.0%라지만…소수점 둘째자리에 숨겨진 '마이너스 물가',국가 '바이오 데이터 스테이션' 내년까지 구축,3D 프린팅·센서·로봇 포함…뿌리산업 14개로 늘린다,[포토] 해양 쓰레기 수거 나선 수협,전주 한옥마을에서 3∼5일 '대한민국 동행세일',"""백종원처럼 음식 조리법까지 전수""…골목상권 살리기 나선 은행들",노사정 타협 걷어찬 민주노총…그 뒤엔 '30년 계파갈등',"캠코, 국유부동산 123건 공개 대부·17건 매각","편의점주 ""최저임금 1만원 되면 줄폐업…2019년 수준 낮춰야""","중국 등 12개국 ""코로나19 시대 무역장벽 쌓지 말자"" 성명",내부도 내맘대로…삼성의 1200만원짜리 냉장고,"""알리바바에서 돌파구 찾자"" 충북도 중소기업 입점 지원",[포토] LG전자 타임스스퀘어 광고판에 제품 대신 '졸업사진',GS칼텍스 허세홍 '업사이클링 경영',"두산중공업, UAE 화력발전소 사업…700억 규모 수주",휴비스 '전주공장 시대'…울산공장과 설비 통합 마쳐,"포스코케미칼, 인조흑연 음극재 국산화 첫삽…포항에 공장","중고차 거래 AJ셀카, 매물로",현대글로비스 '5000억 대박'…폭스바겐 독점 운송한다,"수소모빌리티+쇼, 국제수소포럼 열어","제주항공, 이스타에 사실상 '계약 파기' 선언","수소경제시대 온다…전문가 ""주도권 잡으려면 최대한 빨리""",강원 홍천서 평균 체중 2배 '1.3t 슈퍼한우' 탄생하나(종합),"기재부, 종부세법개정안 연내 통과 위해 예산부수법안 신청 계획",부산 사회적경제기업 제품 구매 캠페인 '핸드인핸드',"""어성초·찔레·왕대로 화장품을""…남원시 화장품산업 육성 박차",'첵스 파맛'은 우유 대신 설렁탕에? 황금레시피 떴다,"포스코케미칼, 전기차배터리 핵심소재 국산화 속도 낸다",사모펀드에 칼 빼든 금융당국…펀드 1만여개·운용사 233개 전수조사,"무안군, 전국 최대 19만㎡ 첨단농업복합단지 조성",국고채 금리 일제히 하락…3년물 연 0.831%,"포스코케미칼, 전기차용 '인조흑연 음극재' 국산화 첫발","대만, 사무소 개설해 홍콩 금융인 등 인재 영입 나서","아이마켓코리아, 화상회의 패키지 출시",사모펀드 1만여개 전수조사…운용사 233개 3년간 현장검사,"[팩트체크] 신종돼지독감때문에 삼겹살 먹어도 위험?…""괜찮다""",'국가균형 프로젝트' 여수 화태-백야 연륙·연도사업 속도,2년 만에 광화문 직장인의 출근 동선을 바꾼 '펠트커피',"""반바지 입고 출근해도 됩니다"" 복장 자율화 부산제조업체 화제",대구·경북 6월 소비자 물가 5월보다 소폭 상승,대구 시내버스 전 차량 내부에 항균 필름 부착,원/달러 환율 하락…위안화 강세·주가 상승에 연동,"""누구나 노브랜드 버거 사장 된다""…가맹 모집하는 신세계","라임 펀드 피해자들, ""환매 신청 멋대로 취소"" 대신증권 고소","글로핸즈, 마이지놈박스스튜디오와 전자계약 협력 MOU 체결",제로페이 도입 1년6개월…결제액 5000억원 돌파,"한국표준협회, 서비스품질 향상을 통한 서비스 활성화 논의","시트로엥, C4 전기차 선봬","""포스트코로나 대비 중소-대기업 상생·혁신 강화해야""","""온라인 수출 지원 돕자"" 대전·세종 11개 기관 한뜻"
2020.07.03,금융위 추경 4조7천억…'코로나 극복' 소상공인·기업 지원,"젠투파트너스, 1.3조원 규모 펀드 환매 연기 통보","""경영악화 책임""…이상직 딸 이수지, 이스타항공 상무직 사임","아이배냇, 2020년 충주시 '여성친화기업' 선정","홍남기 ""동행세일 할인혜택 커…소상공인 살리기에 힘 보태달라""","산은 ""올해 기업 설비투자 154조 전망…코로나로 작년보다 축소""",상반기에만 13만대 팔린 수입차…테슬라가 '슈퍼 루키',지난달 외환보유액 4107억弗 '사상 최대','악몽의 2분기' 반도체로 겨우 넘겼다,"방관하던 김현미 장관, 중재 나섰지만…막장 치닫는 이스타항공 매각","식약처, '바라밀 씨앗' 함유된 수입 절임식품 판매중단·회수",'제3의 공간' 된 오피스…스타벅스와 경쟁하라,"베스트바이 등 영업 재개에…LG전자, 6월 美 가전매출 두 배 늘어",더 센 '稅폭탄' 준비…다주택자 종부세 '최고세율 4%' 넘을 수도,카드사 정보유출 고객에 문자 안내…콜센터 문의 쇄도,[포토] 혈액부족에 헌혈 나선 SK 임직원,미국 우주탐사 최강국 '굳히기' vs.중국 우주굴기 '뒤집기',[반론보도][단독] '연15%' 내걸고 돌려막기…P2P업계 '라임사태' 터졌다 관련,GM·도요타보다 낫네…美서 선방한 현대·기아차,"SK텔레콤 ""스마트공장 솔루션 구독하세요""","""아시아나 기업결합, 해외심사 끝났지만…""",재택근무 바람에…잘나가는 K공기청정기,포스코케미칼·OCI 합작…고순도 과산화수소 연 5만t 생산,해고 통보 전문가도 영상통화 한 통으로 실직…갑작스레 마주한 '비대면 세상'의 두 얼굴,"민주노총, 20일 대의원대회 열어…사회적 대타협 합의안 결론낸다",광주 소매·유통업 경기 전망 '먹구름 여전'…4분기 연속 부진,P2P 대출 1위 테라펀딩 연체율 빨간불,[포토] 가전판매 현장 방문한 성윤모 장관,"저축은행 지점 설치, 인가제→신고제 추진",1000만 마일 달성의 꿈…항공사 마일리지는 왜 '선망의 가치'가 됐을까,인터넷신문 '바끄로 뉴스' 발행인에 박종철,초고속 조성하더니…기안기금 두달째 개점휴업,"""일본 중산층이 줄어든다""-옥스퍼드 이코노믹스 보고서",국고채 금리 일제히 상승…3년물 연 0.838%,정읍 논에서 '살아 있는 화석' 긴꼬리투구새우 대량 서식,"이스타노조 ""제주·애경, 구조조정·임금체불 지휘 후 인수거부""(종합2보)",원/달러 환율 소폭 하락…변동성 작은 장세,누수사고 예천양수발전소 지하발전소 배수작업 본격화,"안산 제조업체, 3분기 기업경기 전망 여전히 '비관적'","코스피 이틀째 상승 마감…2,150선 회복(종합)","""항공사 M&amp;A 성사되도록 노력해달라""…김현미 장관 업계 면담","코스피 이틀째 상승 마감…2,150선 회복","탈원전 비용에 전기요금 활용…""국민부담"" vs ""정당집행""",아시아나항공 인수 승인받은 현산 이제 속도낼까,제주서 곱절 크기 '슈퍼 한우' 나와 화제…도체중 800㎏,"제주항공 통보에 이스타 노조 ""구조조정 지시 후 인수 거부""","금융위, 적극행정 실천한 공무원 6명 포상",에스티유니타스 '공단기' 업계 최초 불합격해도 전액 환급,"광주은행, 지방은행 첫 소상공인 비대면 대출 서비스 시행",코로나가 바꾼 풍경…카드사 여름 이벤트 '호캉스'에 집중,[오디오래빗] 꿉꿉한 집안 습도 잡는 #제습기 영어로 뭐게?,저축은행 지점 설치 인가제→신고제,"개소세 효과에 6월에도 수입차 질주…테슬라, 2천827대 팔았다(종합)",조폐공사·한국투명성기구 업무협약…청렴문화 조성협력,[팩트체크] 3년새 3400곳 늘었다…서울 지도 빼곡히 채운 커피점,"전문인재 영입한 인터로조 ""글로벌 콘택트렌즈 시장 공략 박차""",금주(6월26일~7월2일)의 신설법인 706개,"캠코, 서울·부산 아파트 등 압류재산 798건 공매",한라산서 응급환자 구급물품 '드론 배송' 테스트,"이스타노조 ""제주·애경, 구조조정 지시하고 인수 거부하냐""(종합)","기아차, 미국 시장에서 상반기 판매 13.6% 감소","LG전자, 퓨리케어 공기청정기로 해외 시장 공략 '속도'",재난지원금 지급된 5월 온라인쇼핑 음식료품 거래 증가세 둔화,상반기 상장사 55곳 상호 변경…'회사 이미지 제고' 많아,"지역 신협 대출 영업범위, 전국 10개 광역권으로 넓어진다","현대제철 순천공장, 혁신 활동으로 품질 개선","이스타노조 ""제주·애경, 구조조정 지시하고 인수 거부하냐""","현대모비스, 미 테크펀드에 2천만달러 출자…미래차 기술확보","러시아, 현산-아시아나 결합 승인…해외 승인 절차 마무리(종합)",볼보 안전띠 결함 문제로 전세계 차량 210만대 리콜,"6월 수입차 판매, 1위 E클래스 7위 알티마","페라리, 동등임금인증 수여","""수소에너지 널리 알려요""…'수소경제 서포터즈' 발족","""460만살 독도에 숨겨진 이야기, 숫자로 한눈에 봐요""",[포토] 성윤모 장관 으뜸효율 가전환급 현장방문,"""서리 피해 걱정 없어요"" 영월군 사과 재배지 17ha에 예방시설",개소세·신차 효과에 6월에도 수입차 질주…작년보다 41% 증가,"러시아, 현산-아시아나 결합 승인…해외 승인 절차 마무리","홈매트 리퀴드 전자모기향, 20년 만에 1천만개 판매",FDA 인증품이라더니…코로나 틈탄 중국산 밀수 체온계 유통,유기농 성분에 생분해까지 되는 생리대가 나왔다,카드번호 유출 62만개 중 138개 부정사용…1천만원 피해,학교급식 농산물 순회수집·고정가 매입…당진시 공급체계 구축,"LG전자, 에너지효율 1등급 원바디 세탁건조기 출시","유한킴벌리, 생분해성 생리대 개발…""12주면 100% 퇴비화""","BBQ, 가맹점 물품대금 결제전용 카드 도입","와이즈오토, 스프린터 티몬 최저가 프로모션 진행","상반기 수입차, 일본차 부진에도 17.3% 늘었다",기보 벤처캐피탈 투자매칭 보증 신설…최대 50억원 지원,"쌍용차, 11번가와 티볼리 공동 마케팅 열어","중기중앙회, 소상공인 지원 '노란우산 재기교육' 시작","롯데리조트, '코로나19 직격탄' 맞은 개인숙박업 무료 컨설팅",원/달러 환율 약보합세…미 고용지표 호조 영향,"'배추 국장' 부활?…김용범 ""소·돼지고기 가격 급등 살펴볼 것""","""무더위 잡아라""…위니아에이드, 16일까지 에어컨 대전","기재부 차관 ""돼지고기·한우 가격 상승 면밀히 살필 것""",[여행소식] 프린세스 크루즈 2021∼2022년 미국 일정 발표,"""캐딜락 CT5, 미국보다 한국이 수 백 만원 더 저렴""","기재차관 ""돼지고기·한우 가격 상승 면밀히 살펴볼 것""",포터 캠핑카 등장에 모터홈 시장 '기대반 걱정반'
2020.07.04,검찰 '옵티머스' 대표 체포…펀드사기 혐의 조사,"공공운수노조, 이스타항공 임금체불 사태 해결 촉구",임영웅 커피에 이찬원 흑마늘…40대 지갑 여는 '트롯 소비',"한울원전 2호기 터빈 수동정지 ""수질 저하 원인, 방사선 유출 無""",한울원전 2호기 터빈 수동정지…방사선 외부 유출 없어(종합),영국 정부 '위성 인터넷망' 원웹 지분 45% 인수,농식품 추경 2천905억원…농산물·외식·농촌관광 할인쿠폰 제공,비말차단 마스크 20만장 푼다던 메가마트 물량 못 구해 취소,[고침] 지방(한울원전 2호기 터빈 정지…방사선 외부 유출…),휘발유 가격 6주 연속 올라…ℓ당 1천355.4원,휘발윳값 6주 연속↑ ℓ당 1355.4원…서울 가장 비싸고 대구 저렴,한울원전 2호기 터빈 정지…방사선 외부 유출 없어,5월 경상수지도 적자일까…세수 감소 규모도 관심,"트롯왕 임영웅, G4 렉스턴 살렸다","야콥 할그렌 대사 ""스웨덴 제품 사랑받는 이유? 韓 수준 높기 때문""",이케아·볼보부터 H&amp;M·스포티파이까지…스웨덴에 빠진 한국,"제주·이스타 공방, 폭로전으로 확산…김현미 ""M&amp;A 노력해달라""",서울서 한밤중 아파트 흙막이 시설 기우뚱…주민 대피,대한민국 동행세일 최고 매출 부산 화장품 기업 화제,고수익 좇는 2030 동학개미…인구당 주식계좌 한국이 미국 2배,"제주·이스타, 진실공방 넘어 폭로전 가나…김현미 면담 '변수'",수요 절벽에 철광석값은 천정부지…철강업계 '이중고',"NASA 출신 현대차 부사장, 구글 출신 삼성 상무…S급 인재 영입 나선 대기업들","에어프랑스 7천580명 감원…""코로나로 매출 95% 감소""",휘발유 가격 6주 연속 올라…ℓ당 1355.4원,"파격적인 포스코의 유아기 재택근무, 다른 기업에도 확산할까","[주말N쇼핑] 백화점은 패션상품, 대형마트는 수박·대게 할인",농수산물 등 8대 소비쿠폰 푼다…456만명 인플루엔자 무상접종,,,,,,,,,,,,,,,,,,,,,,,,,,,,,,,,,,,,,,,,,,,,,,,,,,,,,,,,,,,,,,,,,,,,,,,,
